



INSERT into employees(emp_no,birth_date,first_name,last_name,gender,hire_Date)
  VALUE(1,'2002-12-04',"Muhammad","zain","M",'2014-02-02')

INSERT into employees(emp_no,birth_date,first_name,last_name,gender,hire_Date)
      VALUE(2,'2004-09-05',"Muhammad","shafiq","M",'2018-11-12')





--insertion into dept_emp-------
INSERT into dept_emp(emp_no,dept_no,from_date,to_date)
  VALUE(1,"123",'2014-02-02','2024-02-02')

INSERT into dept_emp(emp_no,dept_no,from_date,to_date)
    VALUE(2,"321",'2018-11-12','2030-02-02')





---------insertion into the salaries--------



INSERT into salaries(emp_no,salary,from_date,to_date)
    VALUE(1,20000,'2014-02-02','2024-02-02')

INSERT into salaries(emp_no,salary,from_date,to_date)
  VALUE(2,15000,'2018-11-12','2030-02-02')




--- insertion into the titles -------------------


INSERT into titles(emp_no,title,from_date,to_date)
  VALUE(1,"computer Science",'2014-02-02','2024-02-02')

INSERT into titles (emp_no,title,from_date,to_date)
VALUE(2,"software engineering",'2018-11-12','2030-02-02')



---insertion into the ------------

INSERT into dept_manager(dept_no,emp_no,from_date,to_date)
  VALUE(1,"123",'2014-02-02','2024-02-02')

INSERT into dept_manager(dept_no,emp_no,from_date,to_date)
    VALUE(2,"321",'2018-11-12','2030-02-02')





---- insertion into the Deparment;

INSERT into departments(dept_no,dept_name)
  VALUE('123',"Comuter Science")

INSERT into departments(dept_no,dept_name)
    VALUE('321',"Software engineering")



c. Change the name of a department.


mysql> select * from departments;
+---------+----------------------+
| dept_no | dept_name            |
+---------+----------------------+
| 123     | Comuter Science      |
| 321     | Software engineering |
+---------+----------------------+
2 rows in set (0.00 sec)

mysql> update departments
    -> set dept_name='chemical Engineering'
    -> where dept_no='123'
    -> ;
Query OK, 1 row affected (0.08 sec)
Rows matched: 1  Changed: 1  Warnings: 0

mysql> select * from departments;
+---------+----------------------+
| dept_no | dept_name            |
+---------+----------------------+
| 123     | chemical Engineering |
| 321     | Software engineering |
+---------+----------------------+
2 rows in set (0.00 sec)


b. Update an employees’ salary.

mysql> update salaries set salary=300000 where emp_no =1;
Query OK, 1 row affected (0.03 sec)
Rows matched: 1  Changed: 1  Warnings: 0

mysql> select * from salaries;
+--------+--------+------------+------------+
| emp_no | salary | from_date  | to_date    |
+--------+--------+------------+------------+
|      1 | 300000 | 2014-02-02 | 2024-02-02 |
|      2 |  15000 | 2018-11-12 | 2030-02-02 |
+--------+--------+------------+------------+
2 rows in set (0.00 sec)


d ...change an employees’ job title.

mysql> update titles
    -> set title="Labour"
    -> where emp_no= 2;
Query OK, 1 row affected (0.06 sec)
Rows matched: 1  Changed: 1  Warnings: 0

mysql> select * from titles
    -> ;
+--------+------------------+------------+------------+
| emp_no | title            | from_date  | to_date    |
+--------+------------------+------------+------------+
|      1 | computer Science | 2014-02-02 | 2024-02-02 |
|      2 | Labour           | 2018-11-12 | 2030-02-02 |
+--------+------------------+------------+------------+
2 rows in set (0.00 sec)



e....e. Change an employees’ hire date.


mysql> update employees set hire_date ='2010-01-01' where emp_no=1;
Query OK, 1 row affected (0.12 sec)
Rows matched: 1  Changed: 1  Warnings: 0

mysql> select * from employees;
+--------+------------+------------+-----------+--------+------------+
| emp_no | birth_date | first_name | last_name | gender | hire_date  |
+--------+------------+------------+-----------+--------+------------+
|      1 | 2002-12-04 | Muhammad   | zain      | M      | 2010-01-01 |
|      2 | 2004-09-05 | Muhammad   | shafiq    | M      | 2018-11-12 |
+--------+------------+------------+-----------+--------+------------+
2 rows in set (0.00 sec)




3. DELETE a couple of records.

a. DELETE every employee who was hired before February 2016.

mysql> delete from employees where hire_date between '2001-01-01' and '2017-01-01';
Query OK, 1 row affected (0.05 sec)

mysql> select * from employees;
+--------+------------+------------+-----------+--------+------------+
| emp_no | birth_date | first_name | last_name | gender | hire_date  |
+--------+------------+------------+-----------+--------+------------+
|      2 | 2004-09-05 | Muhammad   | shafiq    | M      | 2018-11-12 |
+--------+------------+------------+-----------+--------+------------+
1 row in set (0.00 sec)

b. DELETE all departments.

mysql> delete  from departments;
Query OK, 2 rows affected (0.05 sec)

mysql> select * from departments;
Empty set (0.00 sec








----------------------------------------------------------------------------


CREATE TABLE PRODUCTS(

	p_id int NOT NULL PRIMARY KEY ,
	p_name VARCHAR(60) NOT NULL,
	units int NOT NULL,
	unit_price NUMERIC(60) NOT NULL,
	type VARCHAR(60) NOT NULL,
	s_id int NOT NULL ,
	FOREIGN KEY (s_id) REFERENCES suppliers(s_id) on DELETE CASCADE

);
create database pharma;
CREATE TABLE suppliers(

	s_id int NOT NULL PRIMARY KEY,
	s_name VARCHAR(60) NOT NULL,
	contact VARCHAR(60) NOT NULL,
	city VARCHAR(60) NOT NULL
		)


CREATE TABLE orders(
	order_id int NOT NULL PRIMARY key,
	customer_name VARCHAR(60) NOT NULL,
	order_date VARCHAR(60) NOT NULL
	);
CREATE TABLE order_detail(
	p_id int NOT NULL ,
	order_id int NOT NULL  ,
	unit_purchased int NOT NULL,
	PRIMARY key (p_id,order_id)

	);


____insertion____
insert into PRODUCTS(p_id,p_name,units,unit_price,type,s_id)
	VALUE(1005,'ponstan',100,15,'tablets',312);

insert into PRODUCTS(p_id,p_name,units,unit_price,type,s_id)
VALUES (1421,'BRUGFEN',25,35,'srup',657);


insert into PRODUCTS(p_id,p_name,units,unit_price,type,s_id)
VALUES (3125,'Avil',122,26,'srup',478);


insert into PRODUCTS(p_id,p_name,units,unit_price,type,s_id)
VALUES (1215,'flagyl',42,30,'tablets',987);


insert into PRODUCTS(p_id,p_name,units,unit_price,type,s_id)
VALUES (7513,'Avil',140,20,'injection',478);


insert into PRODUCTS(p_id,p_name,units,unit_price,type,s_id)
VALUES (1216,'flagyl',10,35,'syrup',987);

insert into PRODUCTS(p_id,p_name,units,unit_price,type,s_id)
VALUES (1007,'disprin',98,15,'tablets',320);

--- insert into the supplier tables
insert into suppliers(s_id,s_name,contact,city)
	VALUES(320,'Munir Brother','0321-123456789','karachi');

insert into suppliers(s_id,s_name,contact,city)
	VALUES(312,'Aliance phamrecuticals','0313-7654321','Peshawar');

insert into suppliers(s_id,s_name,contact,city)
	VALUES(478,'Ab bot phamrecuticals','0300-987654321','Lahore');

insert into suppliers(s_id,s_name,contact,city)
	VALUES(657,'Senofi Aventis','0333-5632476','isalamabad');

insert into suppliers(s_id,s_name,contact,city)
	VALUES(987,'Ferozsons laboratories','0301-1934257','Peshawar');



---insertion into order table
insert into orders(order_id,customer_name,order_date)
	VALUES(22,'Waleed ali','11/25/2014')

insert into orders(order_id,customer_name,order_date)
	VALUES(23,'azhar akbhar','12/02/2014')

insert into orders(order_id,customer_name,order_date)
	VALUES(24,'Shehzab khan','12/05/2014')

insert into orders(order_id,customer_name,order_date)
	VALUES(25,'javed iqbal','1/15/2015')

insert into orders(order_id,customer_name,order_date)
	VALUES(26,'Tariq irqbal','06/23/2015')


---insertion in order detail tables
insert into order_detail(p_id,order_id,unit_purchased)
	VALUES(1007,22,5);


insert into order_detail(p_id,order_id,unit_purchased)
	VALUES(1216,22,1);

insert into order_detail(p_id,order_id,unit_purchased)
	VALUES(1005,22,4);

insert into order_detail(p_id,order_id,unit_purchased)
	VALUES(1421,23,1);

insert into order_detail(p_id,order_id,unit_purchased)
	VALUES(1005,23,1);


insert into order_detail(p_id,order_id,unit_purchased)
	VALUES(3215,23,2);

insert into order_detail(p_id,order_id,unit_purchased)
	VALUES(7513,23,3);

insert into order_detail(p_id,order_id,unit_purchased)
	VALUES(1421,24,2);

insert into order_detail(p_id,order_id,unit_purchased)
	VALUES(1215,24,1);

insert into order_detail(p_id,order_id,unit_purchased)
	VALUES(1005,25,5);

insert into order_detail(p_id,order_id,unit_purchased)
	VALUES(1215,26,1);

insert into order_detail(p_id,order_id,unit_purchased)
	VALUES(1421,26,3);

(4...)
mysql> update suppliers
    -> set s_name="Muneer Brother"
    -> where s_id=320;
Query OK, 1 row affected (0.06 sec)
Rows matched: 1  Changed: 1  Warnings: 0

mysql> select * from
    -> suppliers;
+------+------------------------+----------------+------------+
| s_id | s_name                 | contact        | city       |
+------+------------------------+----------------+------------+
|  312 | Aliance phamrecuticals | 0313-7654321   | Peshawar   |
|  320 | Muneer Brother         | 0321-123456789 | karachi    |
|  478 | Ab bot phamrecuticals  | 0300-987654321 | Lahore     |
|  657 | Senofi Aventis         | 0333-5632476   | isalamabad |
|  987 | Ferozsons laboratories | 0301-1934257   | Peshawar   |
+------+------------------------+----------------+------------+

(5....)
mysql> delete from
    -> PRODUCTS
    -> WHERE p_name="Avil"
    -> ;
Query OK, 2 rows affected (0.05 sec)

mysql> select * from PRODUCTS;
+------+---------+-------+------------+---------+------+
| p_id | p_name  | units | unit_price | type    | s_id |
+------+---------+-------+------------+---------+------+
| 1005 | ponstan |   100 |         15 | tablets |  312 |
| 1007 | disprin |    98 |         15 | tablets |  320 |
| 1215 | flagyl  |    42 |         30 | tablets |  987 |
| 1216 | flagyl  |    10 |         35 | syrup   |  987 |
| 1421 | BRUGFEN |    25 |         35 | srup    |  657 |
+------+---------+-------+------------+---------+------+
5 rows in set (0.00 sec)


(6....)

mysql> select * from PRODUCTS;
+------+---------+-------+------------+---------+------+
| p_id | p_name  | units | unit_price | type    | s_id |
+------+---------+-------+------------+---------+------+
| 1005 | ponstan |   100 |         15 | tablets |  312 |
| 1007 | disprin |    98 |         15 | tablets |  320 |
| 1215 | flagyl  |    42 |         30 | tablets |  987 |
| 1216 | flagyl  |    10 |         35 | syrup   |  987 |
| 1421 | BRUGFEN |    25 |         35 | srup    |  657 |
+------+---------+-------+------------+---------+------+
5 rows in set (0.00 sec)

mysql> update PRODUCTS
    -> set unit_price=40
    -> where type="tablets";
Query OK, 3 rows affected (0.31 sec)
Rows matched: 3  Changed: 3  Warnings: 0

mysql> select * from PRODUCTS;
+------+---------+-------+------------+---------+------+
| p_id | p_name  | units | unit_price | type    | s_id |
+------+---------+-------+------------+---------+------+
| 1005 | ponstan |   100 |         40 | tablets |  312 |
| 1007 | disprin |    98 |         40 | tablets |  320 |
| 1215 | flagyl  |    42 |         40 | tablets |  987 |
| 1216 | flagyl  |    10 |         35 | syrup   |  987 |
| 1421 | BRUGFEN |    25 |         35 | srup    |  657 |
+------+---------+-------+------------+---------+------+
5 rows in set (0.00 sec)
--------------------------------------------------------------------------



(7----)
( No  this will not effect the order_detail because here is not foreign key from order_detail so that why!)


mysql> select * from orders;
+----------+---------------+------------+
| order_id | customer_name | order_date |
+----------+---------------+------------+
|       22 | Waleed ali    | 11/25/2014 |
|       23 | azhar akbhar  | 12/02/2014 |
|       24 | Shehzab khan  | 12/05/2014 |
|       25 | javed iqbal   | 1/15/2015  |
|       26 | Tariq irqbal  | 06/23/2015 |
+----------+---------------+------------+
5 rows in set (0.00 sec)

mysql> delete from orders
    -> where order_id=22;
Query OK, 1 row affected (0.05 sec)

mysql> select * from orders;
+----------+---------------+------------+
| order_id | customer_name | order_date |
+----------+---------------+------------+
|       23 | azhar akbhar  | 12/02/2014 |
|       24 | Shehzab khan  | 12/05/2014 |
|       25 | javed iqbal   | 1/15/2015  |
|       26 | Tariq irqbal  | 06/23/2015 |
+----------+---------------+------------+
4 rows in set (0.00 sec)


---------------------------------------------------------------------
(8.............)



mysql>
mysql> describe PRODUCTS;
+------------+---------------+------+-----+---------+-------+
| Field      | Type          | Null | Key | Default | Extra |
+------------+---------------+------+-----+---------+-------+
| p_id       | int(11)       | NO   | PRI | NULL    |       |
| p_name     | varchar(60)   | NO   |     | NULL    |       |
| units      | int(11)       | NO   |     | NULL    |       |
| unit_price | decimal(60,0) | NO   |     | NULL    |       |
| type       | varchar(60)   | NO   |     | NULL    |       |
| s_id       | int(11)       | NO   | MUL | NULL    |       |
+------------+---------------+------+-----+---------+-------+
6 rows in set (0.00 sec)

mysql> truncate table PRODUCTS;
Query OK, 0 rows affected (0.18 sec)

mysql> show tables;
+------------------+
| Tables_in_pharma |
+------------------+
| PRODUCTS         |
| order_detail     |
| orders           |
| suppliers        |
+------------------+
4 rows in set (0.00 sec)




(last .....................)




mysql> drop table PRODUCTS,orders,order_detail,suppliers;
Query OK, 0 rows affected (0.80 sec)

mysql> show tables;
Empty set (0.00 sec)

mysql> truncate table order_detail;
Query OK, 0 rows affected (0.20 sec)

mysql> truncate table orders;
Query OK, 0 rows affected (0.17 sec)

mysql> tuncate table suppliers;
ERROR 1064 (42000): You have an error in your SQL syntax; check the manual that corresponds to your MySQL server version for the right syntax to use near 'tuncate table suppliers' at line 1
mysql> truncate table suppliers;
ERROR 1701 (42000): Cannot truncate a table referenced in a foreign key constraint (`pharma`.`PRODUCTS`, CONSTRAINT `PRODUCTS_ibfk_1` FOREIGN KEY (`s_id`) REFERENCES `pharma`.`suppliers` (`s_id`))
mysql> SET FOREIGN_KEY_CHECKS = 0 ;
Query OK, 0 rows affected (0.00 sec)

mysql> truncate table suppliers;
Query OK, 0 rows affected (0.18 sec)

mysql> SET FOREIGN_KEY_CHECKS = 1 ;
Query OK, 0 rows affected (0.01 sec)

mysql>
